#Question|Class|WH|WH-Bigram|WH-POS|WH-NBOR-POS
Which French monarch reinstated the divine right of the monarchy to France and was known as `The Sun King' because of the splendour of his reign? |P|Which|Which French|WDT|NNP
The `Wicked Bible', printed in 1631, became so called because the word `not' was omitted from which of the Ten Commandments? |A||||
Which eponymous hero of a work first published in 1902 was warned of the dangers lurking in a nearby garden with the words `Your father had an accident there; he was put in a pie by Mr. McGregor'? |P|Which|Which eponymous|WDT|JJ
Which European patron saint was once a ruler of Bohemia and has given his name to a Square in Prague? |P|Which|Which European|WDT|JJ
Which Italian term describes a virtuoso passage, usually for a solo instrument near the end of a concerto, originally intended to have an improvisatory character. |X|Which|Which Italian|WDT|JJ
Which boxer, representing Canada, won the 1988 Olympic Super-Heavyweight Gold Medal, defeating Riddick Bowe of the USA in the final? |P|Which|Which boxer|WDT|NN
Which competition was won by Eimear Quinn with `The Voice' in 1996, this being the fourth win in five years for her country? |X|Which|Which competition|WDT|NN
Which battle, whose 250th anniversary was celebrated in April 1996, was fought on a part of Drummossie Muir whose name translates from the Gaelic as `stinking bog'? |X|Which|Which battle|WDT|NN
Which fibre is produced from two species of of Corchorus plant, was first exported to the west from India in in the 1790s and from 1822 was manufactured commercially into yarn in Dundee? |X|Which|Which fibre|WDT|NN
Which Jane Austen heroine was told by her father, ``Your mother will never see you again if you do not marry Mr. Collins, and I will never see you again if you do.''? |P|Which|Which Jane|WDT|NNP
Strenuous exercise can cause a build-up of which acid in the muscles. |X||||
Which commission was established in 1948 but adopted its present name in 1973 under the Fair Trading Act and has embraced the Competition Act since 1980? |O|Which|Which commission|WDT|NN
Which performing arts complex was opened was opened in 1973 and was reported by National Geographic magazine as having had its roofline variously described as clam shells, full blown sails or a huddle of nuns in a high wind? |X|Which|Which performing|WDT|VBG
In chemistry, which organic compounds are characterised by the functional group COOH? |X||||
Which British physicist, whose four equations form a complete description of the inter-relation of electric and magnetic fields, gave his name to the c.g.s. unit of magnetic flux? |P|Which|Which British|WDT|JJ
Who became Governor of Hong Kong after he lost his position as MP for Bath in the 1992 General Election? |P|Who|Who became|WP|VBD
From 1955 to 1957, the English soldier and field marshall Sir John Harding was Governor-General of which island during the terrorist campaign against its British administration? |L||||
What name is given to the popular Greek spirit flavoured with aniseed? |X|What|What name|WP|NN
In AD 324, which Roman emperor claimed Byzantium as a new Rome for the Eastern empire? |P||||
The first Violin Concerto in G minor by which composer, born in Cologne in 1838, has been voted Britain's favourite piece of classical music in each of the last three years when Classic FM has compiled a `Hall of Fame' from its listeners' votes? |P||||
Which seven word phrase originated in the United States as the title of a 1936 book on business psychology by Dale Carnegie? |W|Which|Which seven|WDT|CD
Cecil Day Lewis' character Nigel Strangeways, whom he created in the detective novels which he wrote under the pseudonym Nicholas Blake, is widely believed to be based on which poet friend of the author? |P||||
The Russian modern pentathlete Boris Onischenko was disqualified from the 1976 Olympics for cheating in which of the five disciplines? |X||||
Which Sheffield-born pop star was described in `Select' magazine as having `The wit of Alan Bennett in the body of Kenneth Williams'? |P|Which|Which Sheffield-born|WDT|NNP
In September 1995, France exploded a test nuclear weapon approximately 700 miles south-east of Tahiti at which atoll in the South Pacific? |L||||
The Kalahari Desert covers part of Namibia, Zimbabwe and South Africa, but lies primarily within which land-locked country? |L||||
What number results from adding the number of Noble Truths of Buddhism to the number of Pillars of Islam? |A|What|What number|WP|NN
Charles II, also known as Charles the Mad, reigned in Spain from 1665 until 1700 and was the last Spanish monarch of which dynasty? |X||||
Which architect of the 19th century Gothic Revival was born in 1812 and is probably best known for his work, with Charles Barry,x on the Houses of Parliament?|P|Which|Which architect|WDT|NN
"Which novelist, winner of the 1965 Nobel Prize for Literature, wrote ""The Silent Don"", published in two parts as ""And Quiet Flows the Don"" and ""The Don Flows Home to the Sea""? "|P|Which|Which novelist|WDT|NN
Which poet was born in 1572 and appointed Dean of St. Paul's Cathedral in 1621? |P|Which|Which poet|WDT|NN
What name is given to goods sold not primarily to make a profit but to attract customers so that they might buy other goods? |X|What|What name|WP|NN
Which creature is related to the sloth and the anteater, is found primarily in South America, and can be three, six and nine banded? |X|Which|Which creature|WDT|NN
In which city did Hitler and his supporters invade the Burgerbraukeller to stage the abortive Beer Hall Putsch of November 1923? |L||||
Which symphonic piece by Saint-Saens is based on a poem by Henri Cazalis, in which the fiddler Death summons skeletons from their graves at midnight? |W|Which|Which symphonic|WDT|VBD
The shoreline of the Caspian Sea lies on states of the former Soviet Union and which other country? |L||||
Which pope, a member of the Medici family, excommunicated Martin Luther and appointed Henry VIII Defender of the Faith in England? |P|Which|Which pope|WDT|NN
People with the hereditary disease sickle cell anaemia, particularly distributed among the black population of all continents, are resistant to which disease? |X||||
In electronics, what term is used for the range of frequencies within which the performance of a circuit or amplifier does not fall below a specified amount? |X||||
`I met a traveller from an antique land' is the opening line of which poem by Percy Bysshe Shelley? |W||||
Which Australian, nicknamed the Roehampton Rocket, achieved the unique feat of winning lawn tennis's grand slam twice, once as an amateur and once as a professional? |P|Which|Which Australian|WDT|NNP
Which film, released in 1995 and taking it's title from a phrase used by Claude Rains' character in the 1941 film Casablanca, starred Kevin Spacey and Gabriel Byrne? |W|Which|Which film|WDT|NN
Between 1948 and 1957 John Costello was twice Taoiseach, or Prime Minister of the Irish Republic, but who was the Taoiseach before and after Costello and between his two terms? |P||||
`And the Lord spake unto Moses in the wilderness of Sinai' are the opening words (in the Authorised Version) of which book of the Old Testament? |W||||
In the United Kingdom, land identified as having flora and fauna, or geological or physiological features, needing protection may be designated as a SSSI. What do these initials represent? |B||||
Which king was supposedly described by Henry IV of France as `the wisest fool in Christendom'? |P|Which|Which king|WDT|NN
Which illuminated book of the gospels, considered a masterpiece of the Hiberno-Saxon style, can be found in the library of Trinity College, Dublin? |W|Which|Which illuminated|WDT|VBD
Based on the author's early experiences, which novel by Jack London recounts the Alaskan adventures of Jack Thornton and his dog Buck? |W||||
Which writer was appointed Professor of American Studies at the University of East Anglia in 1970? |P|Which|Which writer|WDT|NN
Also known as the Norway lobster or the Dublin Bay prawn, by what name is Nephrops Norvegicus known when sold in food shops and restaurants? |X||||
First established by Fanny Waterman and Marion Harewood in 1963, an international piano competition has been held every three years in which English city? |L||||
What was the name of the USA's planned system of combating incoming nuclear missiles which was represented by the initials SDI? |B|What|What was|WP|VBD
What name is commonly given to the type of fly whose scientific name is Musca Vomitoria, sometimes known as the blow fly? |X|What|What name|WP|NN
Which British mathematician, who in 1854 published `Investigations of the Laws of Thought' is, with Augustus De Morgan, considered to be one of the founding fathers of mathematical logic? |P|Which|Which British|WDT|JJ
Which colonel in the late seventeenth century posed as a clergyman in order to enter the Tower of London to steal the crown jewels? |P|Which|Which colonel|WDT|NN
If you flew due south from Aberdeen, what would be the last English county that you would fly over before encountering the English Channel? |L||||
Whose law states that the rate of diffusion of a gas is inversely proportional to the square root of its density? |P||||
Which fictional character, who combined the roles of gentleman burglar and England cricketer, was created by E. W. Hornung and has been played on screen by Ronald Coleman and David Niven? |P|Which|Which fictional|WDT|JJ
Which thriller series became in 1946 the first daily radio serial broadcast by the BBC, and use `The Devils Gallop' by Charles Williams as its signature tune?|W|Which|Which thriller|WDT|VBZ
Which village in Galilee was the venue of the marriage at which Christ, agreeing to replenish the dwindling supply of festive drinks, turned water into wine? |L|Which|Which village|WDT|NN
Will Hutton, author of the book ``The State We're In'', was appointed Editor of which Sunday broadcast newspaper in March 1996? |X||||
In which game is a goal scored when the ball passes between the central posts, and a behind scored when it passes between the central posts and a behind post? |X||||
In Dostoevsky's novel ``Crime and Punishment'', what is the name of the impoverished student who kills an old pawnbroker for her money? |P||||
The inscription on the tomb of which king in Westminster Abbey includes the words `Malleus Scotorum hic est', meaning `Here is the Hammer of the Scots'? |P||||
Which overture by Brahms, first performed at Breslau in 1881, makes use of four German studen songs including `Gaudeamus Igitur'? |W|Which|Which overture|WDT|NN
Which ancient track follows the southern slope of the North Downs via Winchester and Canterbury to the Kent coast? |L|Which|Which ancient|WDT|JJ
What, according to Shakespeare's Macbeth, `knits up the ravelled sleeves of care'? |X|What|What ,|WP|,
Glyceryl trinitrate belongs to a group of vasodilator drugs used to relieve which condition, linked mainly to diseases of the coronary arteries? |X||||
The physical constant usually denoted by k and having the value 1.38 * 10^-23 Joules per Kelvin, is named after which Austrian born physicist? |P||||
The Learmont report into the escape of prisoners from which jail led to the dismissal of Derek Lewis as Director-General of the Prison Service in 1995? |X||||
Which Florentine building, the work of the architect Giorgio Vasari, was originally constructed to hold the offices of the government judiciary? |X|Which|Which Florentine|WDT|NNP
What three word name is given to the family of joints which has been used in furniture making for centuries and which is identified by its tongue and mouth components? |X|What|What three|WP|CD
Fought in Moravia on 2 December 1805, the Battle of the Three Emperors is otherwise known by which name? |X||||
Widely used in car trim, which metal when added to steel forms protective oxde film on the surface of the steel? |X||||
Which 1990 film, directed by Tim Burton and described as a modern fairy tale was advertised with the words ``His story will touch you, even though he can't''?|W|Which|Which 1990|WDT|CD
In the stories by James Herriot, what surname does he use for the brothers Siegfried and Tristan, the brothers whose vetinary practice he shares? |X||||
What name is given to the syrup which remains after sugar has been crystallized out of cane and from which rum is made? |X|What|What name|WP|NN
Which organization was born out of the the so-called Limehouse Declaration in 1981? |O|Which|Which organization|WDT|NN
The Book of Changes, an ancient book of divination and one of the five classics of Confucianism, is known by which Chinese name? |W||||
The ``Pilgrim's Chorus'' came from which Wagner opera about a minstrel knight of the thirteenth century? |W||||
In the third century BC, which Carthagian general led his forcres to victory over the Romans at locations including the Ticinus River, the Trebia Plain and the shores of Lake Trasimene? |P||||
In which event in the 1908 London Olympics was Dorando Pietri disqualified for being helped across the finishing line by officials? |X||||
Argon is normally mixed with 20% of which element in the filling of electric filament lamps? |X||||
Which author completed his `Sword Of Honour' in 1961 with the novel `Unconditional Surrender'? |P|Which|Which author|WDT|NN
Which land-locked country of North-West Africa beacme an overseas territory of the French Union and was known as French Sudan until it adopted its present name upon independence in 1960? |L|Which|Which land-locked|WDT|JJ
Also known as the missing mass, what term is used for the material of uncertain composition thought to comprise 90% or more of the mass of the universe, undetectable except for its gravitational effect? |X||||
What name is given to the message which the President of the United States delivers to Congress at the start of each year, roughly equivalent to the Queen's Speech in Britain? |X|What|What name|WP|NN
In Greek legend, which daughter of Cassiopeia was chained to a rock as a sacrifice to a sea monster but was rescued by Perseus? |P||||
Which character created by the comedian Steve Coogan is noted for his lager drinnking and hatred of students? |P|Which|Which character|WDT|NN
What name is given to the Minoan scripty used by the prehistoric inhabitants of Crete and mainland Greece between 1400 and 1200 BC, which was eventually deciphered by Michael Ventris in 1952? |X|What|What name|WP|NN
Who entered the University of Konigsberg in 1740 as a theology student, going on fifteen years later to become the Professor of Logic and Metaphysics at the same institution? |P|Who|Who entered|WP|VBD
Which word has entered the language for the practice of raising the price of, or accepting a higher price for, a house after a lower price has been agreed but before the contracts have actually been exchanged? |X|Which|Which word|WDT|NN
In which fourteenth century alliterative poem by William Langford do a series of allegorical visions appear to the narrator in his dreams? |W||||
What is the magnitude of the scalar product of two vectors, a and b, if a is perpendicular to b? |A|What|What is|WP|VBZ
A privilege granted by the Queen by Letters Patent in 1984, which is the only county entitled to call itself `The Royal County'? |L||||
Which French scientist demonstrated the germ theory of disease by eliminating bacteria from silkworms in the 1860s, and went on to work on anthrax and cholera? |P|Which|Which French|WDT|NNP
Which Northern Ireland politician has been the leader of the Social Democratic and Labour Party since 1979? |P|Which|Which Northern|WDT|NNP
According to the satirical magazine Punch, which single word constituted Mr. Punch's advice to those about to marry? |X||||
Of which metallic element is stibnite the ore? |X||||
What is the name of the dog on PBS who likes to dress up and act out famous works of literature?|X|What|What is|WP|VBZ
When Thetis dipped her son in the river Styx trying to make him immortal she grabbed him by this body part which became an idiom for a point of vulnerability?|X|When|When Thetis|WRB|NNP
Name the tie-wearing dog in the Dilbert comic strip.|X||||
What guitarist died in 1971, a year after his electric Star Spangled Banner rocked Woodstock?|P|What|What guitarist|WP|NN
"What did Ralph Kramden drive in the sitcom ""The Honeymooners""?"|X|What|What did|WP|VBD
According to the title of the NBC show, what is the occupation of Rachel Burke, the former prosecutor-turned FBI agent working for the Violent Crimes Task Force?|X||||
Who killed Holofernes by seducing him and beheading him?|P|Who|Who killed|WP|VBD
Who is Chip's Mom in Beauty and the Beast?|P|Who|Who is|WP|VBZ
This toy likes to 'walk' down stairs.|X||||
What is the toy that has multi-colored blocks, used to build things?|X|What|What is|WP|VBZ
A German offensive called the Battle of the Bulge occured during what war?|X||||
On Fox's 'That 70s Show,' where does the gang like to gather to read comics?|L||||
In golf, what is another name for an 'ace'?|X||||
What obsessive habit did the neighbor boy have in 'American Beauty'?|X|What|What obsessive|WP|JJ
What Akira Kurosawa film is based on MacBeth?|W|What|What Akira|WP|NNP
Which Zodiacal Sign is represented by a goat?|X|Which|Which Zodiacal|WDT|NNP
A period of unusually warm weather in fall is given this name.|X||||
How many sides does an Octagon have?|A|How|How many|WRB|JJ
If a girl's nickname is Betsy, what is her full first name most likely to be?|X||||
In what year was CNN launched?|T||||
What city was the home to the long-lived band Aerosmith?|L|What|What city|WP|NN
What color was the incredible Hulk?|X|What|What color|WP|NN
What young composer's employers must have known his genius when the retained him as organist in Arnstadt even though he stayed away for 3 months while on a 1 month leave?|P|What|What young|WP|JJ
What is the capital of Ethiopia?|L|What|What is|WP|VBZ
How many weeks a year does the average American adult spend cleaning up in the kitchen after meals?|A|How|How many|WRB|JJ
How many Sudanese slaves were freed in 1998 because a 4th grade Denver class raised $35,000 to buy their freedom?|A|How|How many|WRB|JJ
Who was the first U.S. president to have a phone on his desk?|P|Who|Who was|WP|VBD
What percentage of his wealth has Microsoft's Bill Gates promised to donate this year for children's vaccines in poor countries.|C|What|What percentage|WP|NN
How many American men are married?|A|How|How many|WRB|JJ
Which major-league pitcher once struck out five batters in one inning.|P|Which|Which major-league|WDT|NN
Who discovered chewing gum?|P|Who|Who discovered|WP|VBD
What is the most popular participator sport in America?|X|What|What is|WP|VBZ
What was St. Patrick's real name? |P|What|What was|WP|VBD
What band got their name from the sixties movie Barbarella?|X|What|What band|WP|NN
What is the name of the original comic strip Bill The Cat appeared in?|W|What|What is|WP|VBZ
What was the name of the character on the 1st Garbage Pail Kids Pack?|P|What|What was|WP|VBD
What was Max Headroom's network number?|A|What|What was|WP|VBD
Which Sci-Fi Sitcom star like to eat cats?|P|Which|Which Sci-Fi|WDT|NNP
Name the late eighties band that named the sides of their first album Hardware and Software and also used samples from Star Trek movies in their songs.|X||||
"Who sang ""I Want My MTV"" on the Dire Straits song ""Money For Nothing""?"|P|Who|Who sang|WP|VBD
"What 80's game show featured the ""Whammy""?"|W|What|What 80|WP|CD
Alanis Morrisette appeared on what 80's cable children's show?|W||||
What was the name of the host of Double Dare?|P|What|What was|WP|VBD
Xavier Roberts was the name associated with which eighties toy?|X||||
What made Michael Milken famous and rich?|X|What|What made|WP|VBD
What was Maggie Seaver's maiden name on Growing Pains?|X|What|What was|WP|VBD
What did the license plate on the Delorean in Back To The Future spell out?|X|What|What did|WP|VBD
What company made PacMan?|O|What|What company|WP|NN
What company made the first color arcade game?|O|What|What company|WP|NN
What was the first video Mtv played?|X|What|What was|WP|VBD
What was the first game show on Mtv?|X|What|What was|WP|VBD
What company used the little aligators as it's symbol on clothing?|O|What|What company|WP|NN
What was the war during Regan's first term that took place on an island in the carribean?|X|What|What was|WP|VBD
Who shot J.R. Euing?|P|Who|Who shot|WP|VBD
What was the first movie Disney released through a subsidary company that carried an R rating?|W|What|What was|WP|VBD
What were the colors of a Rubik's Cube?|X|What|What were|WP|VBD
"What show did the catch phrase, ""Yeah, That's The Ticket"" originate on?"|W|What|What show|WP|NN
What former communist European country was responsible for producing one of the lamest automobiles of the eighties?|L|What|What former|WP|JJ
What was E.T.'s favorite candy?|X|What|What was|WP|VBD
Who was the founder of Live Aid?|P|Who|Who was|WP|VBD
What famous soap opera duo reigned on General Hospital in the eighties?|P|What|What famous|WP|JJ
What eighties TV show starred Bruce Willis in a detective agency?|W|What|What eighties|WP|VBZ
Which quicky brunette was one of the first MTv VJs?|P|Which|Which quicky|WDT|VBD
What was the name of David Hasselhoff's talking car in Knight Ridder?|X|What|What was|WP|VBD
What eighties TV show starred Tom Hanks in women's clothing?|W|What|What eighties|WP|VBZ
What was the name of Eddie Murphy's character in Beverly Hills Cop?|P|What|What was|WP|VBD
What duo lost their Grammy for Best New Artist from the eighties?|X|What|What duo|WP|NN
What late night news show became popular in the eighties after the Iranian Hostage takeover?|W|What|What late|WP|JJ
Who was the female Prime Minister of England throughout the eighties?|P|Who|Who was|WP|VBD
What TV show with married couples and family life appealed to those over the age of 29?|W|What|What TV|WP|NN
What rock magazine that came out in the eighties is now Rolling Stone's major competitor?|X|What|What rock|WP|NN
Which movie prompted the style of wearing cutoff sweatshirts over the shoulder?|W|Which|Which movie|WDT|NN
In which Fox TV show did Johnny Dep play an undercover cop in high school?|W||||
Which TV show portrayed the lives of performing arts high school students|W|Which|Which TV|WDT|NN
"What time would you watch ""Late Night With David Letterman"" on NBC?"|T|What|What time|WP|NN
"What father/daughter duo made ""Gag Me With A Spoon"" a household phrase in the eighties?"|X|What|What father/daughter|WP|NN
Which royal wedding of the eighties is now scandelously coming apart?|X|Which|Which royal|WDT|VBP
Which pain relieving product was subjected to a public relations scare in the eighties?|X|Which|Which pain|WDT|VBP
Who was responsible for the infamous assination attempt on then President Reagan?|P|Who|Who was|WP|VBD
Name at least three arcade games which contributed to the explosion of mall rats?|X||||
What major city calls itself 'The Windy City'? |L|What|What major|WP|JJ
What are the names of Angelica's parents in the Rugrats? |P|What|What are|WP|VBP
In the bible, who's name was changed to Israel? |P||||
What is the last name of the beardless Z.Z.Top band member? |P|What|What is|WP|VBZ
What was the first name of Sherlock Holmes' Dr. Watson? |P|What|What was|WP|VBD
Who conquered the castle of Elvas in Portugal? |P|Who|Who conquered|WP|VBD
What was the first newspaper owned by William Randolph Hearst, Senior? |X|What|What was|WP|VBD
Where is the home location of the 'Blue Angels'? |L|Where|Where is|WRB|VBZ
In what story did Sherlock Holmes make his debut? |W||||
Charlemagne ruled a large part of western and central Europe in the years?|R||||
How long is the national anthem of Greece?|R|How|How long|WRB|JJ
What relationship was Jesus to John the Baptist? |X|What|What relationship|WP|NN
Who was the actress in the 1944 film that said 'You know how to whistle, don't you? You just put your lips together - and blow.'?|P|Who|Who was|WP|VBD
What is the oldest college in the U.S.?|O|What|What is|WP|VBZ
Who was the captain of the Pottsville Maroons football team in 1925?|P|Who|Who was|WP|VBD
What President promised a chicken in every pot?|P|What|What President|WP|NNP
What was the name of the dynasty of the french kings that ended under the French Revolution? |X|What|What was|WP|VBD
Which prominent African-American singer was nominated for a Best Actress Oscar in 1972?|P|Which|Which prominent|WDT|VBD
Who is considered the father of Modern Geology? |P|Who|Who is|WP|VBZ
How many time zones are there in the world? |A|How|How many|WRB|JJ
What is a 300th anniversary called? |X|What|What is|WP|VBZ
What was the Tin Man's name in the Wizard of Oz?|X|What|What was|WP|VBD
What is the play West Side Story based on? |X|What|What is|WP|VBZ
What country is Cornelius Drebbel from?|L|What|What country|WP|NN
What is the name of the most southerly village in mainland Britain?|L|What|What is|WP|VBZ
What is the longest bone in the body? |X|What|What is|WP|VBZ
Which city had the first movie theatre in the US? |L|Which|Which city|WDT|NN
Who directed 8 Man?|P|Who|Who directed|WP|VBD
Who was the director of Godzilla, King of Monsters?|P|Who|Who was|WP|VBD
What is the name of the cape at the southernmost tip of Africa? |L|What|What is|WP|VBZ
How many cows does it take to supply the NFL in footballs for one year?|A|How|How many|WRB|JJ
What was the name of the first steam-powered warship? |X|What|What was|WP|VBD
How many men who signed the Declaration of Independence in 1776 later became US presidents?|A|How|How many|WRB|JJ
How many bones are there in the inner ear?|A|How|How many|WRB|JJ
What was the code name of the D-Day invasion? |X|What|What was|WP|VBD
In Greek mythology, who were the god Zeus' parents?|P||||
