#Question|Class|WH|WH-Bigram|WH-POS|WH-NBOR-POS
About how many people in the United States die each year from the flu?|A||||
Which major market in the United States has the highest Internet penetration?|X|Which|Which major|WDT|JJ
Who is the richest American under the age of 40?|P|Who|Who is|WP|VBZ
What stock performed best during 1999?|X|What|What stock|WP|NN
Who has been the single largest contributor to Bill Bradley's political campaigns?|P|Who|Who has|WP|VBZ
Which of the nation's 100 largest cities has the highest maximum salary for teachers?|L|Which|Which of|WDT|IN
Princeton University has played 34 basketball games at home against Lafayette College, its opponent Saturday night. How many of those games has Lafayette won?|A||||
What percentage of newspapers in the U.S. say they are making a profit from their online site?|C|What|What percentage|WP|NN
How many display advertisements appear in print publications in North America each day?|A|How|How many|WRB|JJ
What was the most popular name for American baby girls in 1999?|P|What|What was|WP|VBD
Which nation has the highest percentage of its population incarcerated?|L|Which|Which nation|WDT|NN
What percentage of people with a mental disorder seek professional counseling at some point during their lives?|C|What|What percentage|WP|NN
Which major U.S. airline had the lowest consumer complaint rate last year?|O|Which|Which major|WDT|JJ
What is the record-low temperature this century for New Year's Eve Day in New Brunswick?|A|What|What is|WP|VBZ
When was the last time the Princeton basketball team defeated Holy Cross, its opponent in Friday's game?|T|When|When was|WRB|VBD
"What does foo-foo mean in ""Caribbean English?"""|X|What|What does|WP|VBZ
Which nation generates the most revenue from tourism?|L|Which|Which nation|WDT|NN
When is the last time an Ivy League basketball team other than Penn or Princeton won an NCAA tournament game?|T|When|When is|WRB|VBZ
During what decade was Christmas first widely celebrated by Americans?|T||||
Which Caribbean resort received the highest rating from readers of CondeNast Traveler magazine?|O|Which|Which Caribbean|WDT|NNP
What was the largest jury verdict awarded to an individual last year?|M|What|What was|WP|VBD
What is the friendliest state in the U.S. for entrepreneurs?|L|What|What is|WP|VBZ
How many users are there worldwide on the Web?|A|How|How many|WRB|JJ
What is the record for most snowfall in a single December day in New Brunswick?|D|What|What is|WP|VBZ
In how many states is it legal to carry concealed weapons?|A||||
How many ships were there in the U.S. Navy in the 1830s?|A|How|How many|WRB|JJ
Against which non-league opponent does the Princeton University basketball team have the highest all-time winning percentage? (Minimum 10 games)|O||||
Which city generates the highest levels of sulphur dioxide in the world?|L|Which|Which city|WDT|NN
What was the population of Princeton Borough when it became incorporated as a separate municipality in 1813?|A|What|What was|WP|VBD
How many gallons of water are used to produce the chips in one computer?|A|How|How many|WRB|JJ
Who has the best pizza in the New Jersey according to the 2000 Zagat Survey?|O|Who|Who has|WP|VBZ
Who is the richest member of Congress?|P|Who|Who is|WP|VBZ
What is the cost of making New Jersey state agencies Y2K compliant?|M|What|What is|WP|VBZ
What is the Princeton men's basketball team's won-lost percentage against Rutgers over the past 20 years?|C|What|What is|WP|VBZ
What country is the most popular destination for college students studying abroad?|L|What|What country|WP|NN
How many e-mail messages does the average U.S. household send and receive per week?|A|How|How many|WRB|JJ
Which ski resort was named the best in North America by readers of Conde Nast Traveler magazine?|O|Which|Which ski|WDT|VBD
How expensive would gas have to become, per gallon, before most consumers would be willing to trade in their current cars for more fuel-efficient models?|M|How|How expensive|WRB|JJ
How many prescriptions for anti-depressants were filled in the United States last year?|A|How|How many|WRB|JJ
How much are Salvadoran workers paid for each $198 Liz Claiborne jacket they sew?|M|How|How much|WRB|JJ
Which Ivy League basketball player scored the most points in a single game during the 1990s?|P|Which|Which Ivy|WDT|NNP
What is the fuel capacity, in gallons, of the Battleship USS New Jersey?|A|What|What is|WP|VBZ
What percentage of European Internet users have access from their homes?|C|What|What percentage|WP|NN
What percentage of suicide attempts involving pills or poison is successful?|C|What|What percentage|WP|NN
What percentage of large U.S. companies reviews employee e-mail?|C|What|What percentage|WP|NN
How many Americans will have traveled 100 miles or more during the Thanksgiving weekend?|A|How|How many|WRB|JJ
What percentage of the discretionary funding in the federal budget goes to the Pentagon?|C|What|What percentage|WP|NN
What is the lowest single-game point total for a Princeton University basketball team in the last 20 years?|A|What|What is|WP|VBZ
What year did the Pilgrims have their first Thanksgiving feast?|T|What|What year|WP|NN
What percentage of Internet users have never purchased anything online?|C|What|What percentage|WP|NN
Which desktop computers have the best repair history according to a survey of Consumer Reports readers?|X|Which|Which desktop|WDT|NN
What percentage of professors at Princeton University are black or Hispanic?|C|What|What percentage|WP|NN
Who is the top recording artist in Russia?|P|Who|Who is|WP|VBZ
The Princeton University football team has played 78 different opponents in its 130-year history. How many of those teams have a winning record against the Tigers?|A||||
What is the lowest temperature ever recorded in November in New Brunswick?|A|What|What is|WP|VBZ
What is the most popular search query on Lycos?|X|What|What is|WP|VBZ
What is the best overall miles per gallon rating for a 2000 model sport utility vehicle?|A|What|What is|WP|VBZ
Which U.S. airport received the highest rating in Conde Nast Traveler magazine's 1999 Readers' Choice Awards?|X|Which|Which U.S.|WDT|NNP
What percentage of the 389 top corporate CEOs who have made donations to the presidential election campaign have contributed to George W. Bush?|C|What|What percentage|WP|NN
Which primetime television program has the highest ratings this season?|W|Which|Which primetime|WDT|JJ
When was the last time either the Yale or Brown football teams, currently tied for first place in the Ivy League, won the league title outright?|T|When|When was|WRB|VBD
What was the median starting salary for journalism school graduates last year?|M|What|What was|WP|VBD
Which pro sports franchise has the highest market value?|O|Which|Which pro|WDT|JJ
Which restaurant in New Jersey serves the best brunch, according to the Zagat Survey?|O|Which|Which restaurant|WDT|NN
"What percentage of federal employees received ""unacceptable"" performance ratings in 1996?"|C|What|What percentage|WP|NN
Which actress has been in the most movies that have grossed more than $100 million?|P|Which|Which actress|WDT|NN
Who is the winningest football coach in Ivy League history?|P|Who|Who is|WP|VBZ
How many hours a week is the average truck driver on the road?|A|How|How many|WRB|JJ
Who is the most popular employer among college juniors and seniors?|O|Who|Who is|WP|VBZ
Which nation has the lowest suicide rate in Europe?|L|Which|Which nation|WDT|NN
What percentage of the tax breaks included in the Lazio-Condit minimum wage bill would go to the wealthiest 1 percent of taxpayers?|C|What|What percentage|WP|NN
Which county in New Jersey has the highest percentage of female arrests?|L|Which|Which county|WDT|NN
During what decade did the Halloween custom come to America?|T||||
What is the web surfer's No. 1 frustration with web sites?|X|What|What is|WP|VBZ
How many times in its 68 meetings with Princeton has Columbia, the Tigers' football opponent Saturday, scored more than 24 points?|A|How|How many|WRB|JJ
What percentage of high school graduates who come from homes with family income of less than $25,000 attend college?|C|What|What percentage|WP|NN
What is the average work week of an American father with children under 18 years of age?|R|What|What is|WP|VBZ
"In 1980, political parties raised $19 million in ""soft money."" How much does Common Cause estimate will be raised in the 2000 elections?"|M||||
What is the most Internet-accessible city in the United States?|L|What|What is|WP|VBZ
How many U.S. newspapers are among the 20 most widely circulated dailies in the world?|A|How|How many|WRB|JJ
When is the last time either Princeton or Harvard has scored more than 28 points against each other?|T|When|When is|WRB|VBZ
What percentage of the U.S. carbonated soft drink market is controlled by Coca-Cola, Pepsi-Cola and Dr. Pepper/Seven Up?|C|What|What percentage|WP|NN
There were 677 cases of gonorrhea reported in Trenton in 1998. How many cases were reported in the rest of Mercer County?|A||||
In 1996, the wealth of the world's 447 billionaires was equal to that of what percentage of the world's least affluent population?|C||||
Which of the following companies took the worst beating in the stock market last week?|O|Which|Which of|WDT|IN
What is the coldest temperature ever recorded in New Brunswick in October?|A|What|What is|WP|VBZ
What is the Princeton University football team's post-World War II record for most consecutive losing seasons?|A|What|What is|WP|VBZ
Which sports utility van is considered the safest on the road by Money magazine?|X|Which|Which sports|WDT|NNS
Which book is most commonly found on the shelves of libraries here and in other countries?|W|Which|Which book|WDT|NN
What percentage of Americans with a household income of $75,000 or more use the Internet?|C|What|What percentage|WP|NN
"What percentage of American women think they are ""happier than their grandmother's generation?"""|C|What|What percentage|WP|NN
What name has been the most popular among newborn boys in New Jersey for each of the past eight years?|P|What|What name|WP|NN
What percentage of employees say they surf the Web at work at least a few times a day?|C|What|What percentage|WP|NN
Which Ivy League university has the highest graduation rate for black students?|O|Which|Which Ivy|WDT|NNP
Which quarterback holds the Ivy League record for most passing yardage in a single season?|P|Which|Which quarterback|WDT|NN
Over the past 35 years, when was defense spending, as a percentage of the total federal budget, at its lowest level?|T||||
Which restaurant in the Princeton-Trenton-New Brunswick-Lambertville area had the highest overall rating for food, decor and service in the most recent Zagat Survey of restaurants?|O|Which|Which restaurant|WDT|NN
Which town has the highest per-capita income in Mercer, Middlesex, Somerset and Hunterdon counties?|L|Which|Which town|WDT|NN
What percentage of Americans held college degrees in the early 1960s?|C|What|What percentage|WP|NN
Which hotel was rated the best in New York City by readers of Travel & Leisure magazine?|O|Which|Which hotel|WDT|NN
Which letter in the Princeton-Suburban phone book has the most pages of listings?|X|Which|Which letter|WDT|NN
Neither Columbia nor Brown has won an Ivy League title in football in more than 20 years. Which team has the third-longest Ivy title drought?|O||||
What percentage of stories aired on PBS during a sample two-week period dealt with international news?|C|What|What percentage|WP|NN
How many of the 18 U.S. presidents who served in the 20th century were graduated from Ivy League schools?|A|How|How many|WRB|JJ
When was the cannon on Princeton University's Cannon Green first brought to the campus?|T|When|When was|WRB|VBD
How far in miles does the typical mouthful of food travel from farm to consumer?|D|How|How far|WRB|RB
Which Ivy League opponent has the Princeton University football team had the most success with during the 1990s?|O|Which|Which Ivy|WDT|NNP
What percentage of Web shoppers who place something in their shopping carts complete their shopping transactions?|C|What|What percentage|WP|NN
Who founded Evelyn College for Women, which operated in Princeton in the latter part of the 19th century?|P|Who|Who founded|WP|VBD
Which city is the greatest distance from New York City?|L|Which|Which city|WDT|NN
In what year was the new Woodrow Wilson School for International Studies at Princeton University dedicated?|T||||
Which country has the highest life expectancy?|L|Which|Which country|WDT|NN
Which soft drink has the most calories?|X|Which|Which soft|WDT|JJ
How many times during the past 15 years has a Princeton University football player won the Ivy League Rookie of the Year award?|A|How|How many|WRB|JJ
"Of the 20 top-rated television programs last week, how many were ""news magazine"" shows?"|A||||
In 1960, when the average male's life expectancy was 68, how many of those years were spent working?|R||||
What was the top grossing Broadway show the first week of this month?|W|What|What was|WP|VBD
Which town had the lowest crime rate in Middlesex, Mercer and Somerset counties in 1998?|L|Which|Which town|WDT|NN
Of the 20 leading occupations for women, which is the highest paying?|X||||
How much are U.S. federal, state and local agencies expected to spend this year to fight the war on drugs?|M|How|How much|WRB|JJ
What percentage of American adults who die leave taxable estates?|C|What|What percentage|WP|NN
Name two U.S. vice presidents who were born in New Jersey?|P||||
Which nation's employees in the industrialized world put in the longest working hours?|L|Which|Which nation|WDT|NN
Which country has the highest recycling rate for glass?|L|Which|Which country|WDT|NN
Which U.S. city had the most homicides last year?|L|Which|Which U.S.|WDT|NNP
"Which island was rated the favorite of Travel & Leisure readers in the magazine's annual ""World Best Awards?"""|L|Which|Which island|WDT|NN
Which country has the world's largest underground economy?|L|Which|Which country|WDT|NN
Which restaurant in Princeton received the highest composite score (food, service, decor) in the new Zagat Survey?|O|Which|Which restaurant|WDT|NN
What percentage of the corn crop in this country is genetically engineered?|C|What|What percentage|WP|NN
In what year was Nassau Hall first occupied?|T||||
How many passengers did Delta bump in the first three months of this year?|A|How|How many|WRB|JJ
What was the average room rate for a hotel room in Manhattan during the first six months of this year? |M|What|What was|WP|VBD
Which country has the least amount of government interference in its economy?|L|Which|Which country|WDT|NN
Which car has the highest retail resale value?|X|Which|Which car|WDT|NN
Which search engine covers the largest percentage of Web pages?|X|Which|Which search|WDT|NN
What percentage of jail inmates were using drugs or alcohol at the time of the offense for which they were incarcerated?|C|What|What percentage|WP|NN
What percentage of people watch less TV today than they did prior to the Internet?|C|What|What percentage|WP|NN
How many of the 18 freshmen defensive players listed on this fall's Princeton University football team weigh more than 240 pounds?|A|How|How many|WRB|JJ
Which country has the highest per-capita incidence of AIDS?|L|Which|Which country|WDT|NN
How many U.S. presidents have visited the Morven mansion in Princeton?|A|How|How many|WRB|JJ
"How many New Jersey residents have drinking water that comes from sources deemed ""unsafe"" for fishing or swimming?"|A|How|How many|WRB|JJ
What is the record for the most rainfall in a single day in August in New Brunswick?|D|What|What is|WP|VBZ
Which country has the world's highest divorce rate?|L|Which|Which country|WDT|NN
In what year was Route 206 in the Princetons completed?|T||||
Which country has the most Internet users, per capita?|L|Which|Which country|WDT|NN
During the past 25 years, what has been the average number of mass murder incidents in the U.S. each year?|A||||
What percentage of the estimated 800 million pages that exist on the Web are pornographic?|C|What|What percentage|WP|NN
"What percentage of residents in the Netherlands reported using marijuana during the ""past month""?"|C|What|What percentage|WP|NN
What's the best-selling paperback on the Publishers Weekly list?|W|What|What 's|WP|VBZ
Which state consumes the most catfish?|L|Which|Which state|WDT|NN
How far below normal are the water levels at the state's major reservoirs?|D|How|How far|WRB|RB
There are 566 municipalities in New Jersey. How many were there in 1880?|A||||
In what year did the number of acts of international terrorism peak?|T||||
What percentage of men over the age of 75 who were polled in an AARP survey said that sexual activity was important to their overall quality of life?|C|What|What percentage|WP|NN
Which hospital in New Jersey has the lowest risk-adjusted mortality rate for coronary artery bypass surgery?|O|Which|Which hospital|WDT|NN
What is the monetary cutoff for filing a damages claim in Small Claims Court in New Jersey?|M|What|What is|WP|VBZ
Which New Jersey county experienced the most population growth, in percentage terms, between July 1997 and July 1998?|L|Which|Which New|WDT|NNP
Which organization spent the most money on lobbying in New Jersey last year?|O|Which|Which organization|WDT|NN
What was the most popular name given to baby girls in England and Wales last year?|P|What|What was|WP|VBD
What is the median age of cars in the U.S.?|Y|What|What is|WP|VBZ
What is the minimum eyesight requirement for obtaining a driver's license in New Jersey?|A|What|What is|WP|VBZ
What percentage of men visited a dentist in 1997?|C|What|What percentage|WP|NN
What is the coldest temperature ever recorded in New Brunswick in July?|A|What|What is|WP|VBZ
Which airport in Europe has the highest percentage of delayed departures?|X|Which|Which airport|WDT|NN
How many golf courses are owned and operated by the state of New Jersey?|A|How|How many|WRB|JJ
What is the most popular content area on newspaper web sites?|X|What|What is|WP|VBZ
Which public college in New Jersey will have the largest tuition increase in 1999-2000?|O|Which|Which public|WDT|JJ
Where was the deadliest hurricane in the United States this century?|L|Where|Where was|WRB|VBD
How many times does the average NYTimes.com user access the site each month?|A|How|How many|WRB|JJ
"Who won the Yahoo! Online Music Award for ""Best Official Artist Site?"""|P|Who|Who won|WP|VBD
What is the average life expectancy in Third World nations?|T|What|What is|WP|VBZ
In what year was the FitzRandolph Gate, the main entrance to the campus of Princeton University, erected?|T||||
In what town is the most expensive apartment complex listed in a statewide apartment guide located?|L||||
What was the debut event at Brendan Byrne Meadowlands Arena in 1981?|X|What|What was|WP|VBD
Which country has the most soldiers and rebels under the age of 18?|L|Which|Which country|WDT|NN
What percentage of employees say they would vote in favor of forming a union at their workplace?|C|What|What percentage|WP|NN
Which college or university raised the most money from alumni, corporations and private donors in 1997-98?|O|Which|Which college|WDT|NN
What percentage of children could qualify as learning disabled under either the federal or state definitions?|C|What|What percentage|WP|NN
Which municipality in New Jersey had the largest percentage increase in population between 1990 and 1998?|L|Which|Which municipality|WDT|NN
Which state has the nation's highest percentage of teen pregnancies ending in abortion?|L|Which|Which state|WDT|NN
How many more, or fewer, people are living in abject poverty today than at the beginning of this decade?|A|How|How many|WRB|JJ
How many of the 29 magazine and newspaper Web sites included in min's New Media Report survey reported increases in page views from April to May?|A|How|How many|WRB|JJ
What is the warmest temperature ever recorded in New Brunswick?|A|What|What is|WP|VBZ
In how many Shore towns in New Jersey is access to all the beaches free?|A||||
What percentage of immigrants who had been in the U.S. for at least 25 years owned their own homes in 1996?|C|What|What percentage|WP|NN
What percentage of high school girls surveyed agreed with the statement that people will be happier if they marry rather than stay single?|C|What|What percentage|WP|NN
How many states ban all fireworks?|A|How|How many|WRB|JJ
How much did the juvenile violent crime rate rise or fall between 1993 and 1997?|P|How|How much|WRB|RB
Which Superior Court judge in Mercer, Middlesex, Somerset and Hunterdon counties had the most decisions overturned on appeal in 1998?|P|Which|Which Superior|WDT|NNP
How many Americans are bitten each year by dogs?|A|How|How many|WRB|JJ
What percentage of the 41,000 Americans killed in motor vehicle accidents in 1997 were male? |C|What|What percentage|WP|NN
What percentage of Web users don't receive at least one spam e-mail message a week? |C|What|What percentage|WP|NN
What is the maximum amount of damages you can recover in Small Claims Court in New Jersey?|M|What|What is|WP|VBZ
What is New York City's most prestigious coop apartment building? |X|What|What is|WP|VBZ
Which was the most popular college choice among students from Princeton Day School, Class of 1999? |O|Which|Which was|WDT|VBD
How many registered Internet domain names are there worldwide? |A|How|How many|WRB|JJ
What percentage of Princeton High graduates will be attending Ivy League schools in the fall? |C|What|What percentage|WP|NN
How many people are victimized by landmines each year? |A|How|How many|WRB|JJ
Which is the most common reportable, communicable disease in New Jersey? |X|Which|Which is|WDT|VBZ
Rutgers is the most popular college choice among this year's graduates at West Windsor-Plainsboro High School. Which college is the runnerup? |O||||
How many nuclear weapons are there in the world today?|A|How|How many|WRB|JJ
What will the annual tuition be for New Jersey students attending Rutgers in 1999-2000? |M|What|What will|WP|MD
How much does the average black American spend annually on lottery tickets? |M|How|How much|WRB|JJ
When did New Jersey public television first go on the air? |T|When|When did|WRB|VBD
What percentage of donations to colleges and universities comes from alumni? |C|What|What percentage|WP|NN
Which nation's government is considered the least corrupt in the world? |L|Which|Which nation|WDT|NN
What percentage of Major League baseball players are from the Caribbean or Latin America? |C|What|What percentage|WP|NN
Which college will enroll the most students from The Lawrenceville School's Class of 1999 this fall?|O|Which|Which college|WDT|NN
What percentage of federal prisoners are incarcerated for non-violent drug offenses?|C|What|What percentage|WP|NN
Which state has the highest per-pupil expenditure for public schools?|L|Which|Which state|WDT|NN
Which national Internet news site has the largest audience share? |X|Which|Which national|WDT|JJ
What is the official New Jersey state shell? |X|What|What is|WP|VBZ
How many state police patrol the N.J. Turnpike? |A|How|How many|WRB|JJ
Which living philanthropist has given the most money to charitable causes?|P|Which|Which living|WDT|NN
Just days before Bill Bradley entered Princeton University as a freshman, he had intended to enroll at which university?|O||||
What was the most frequently diagnosed and/or treated cancer at the Hunterdon Medical Center in 1997?|X|What|What was|WP|VBD
What percentage of Americans think their financial situation is the same or better than it was last year?|C|What|What percentage|WP|NN
Which popular music act's single had the most radio air play in 1980? |X|Which|Which popular|WDT|JJ
How many casualties were there in the Battle of Verdun during World War I? |A|How|How many|WRB|JJ
How many nations have been bombed by the U.S. military in the past eight months?|A|How|How many|WRB|JJ
Which country is projected to have the largest population in the year 2030? |L|Which|Which country|WDT|NN
What is the hottest temperature ever recorded in May in New Brunswick?|A|What|What is|WP|VBZ
For a family of four in New Jersey, what is the maximum amount of income that is exempt from the state income tax?|M||||
What is the median age at the time of marriage for grooms in New Jersey? |Y|What|What is|WP|VBZ
Which casino in Atlantic City generated the most gambling revenue during the past year? |X|Which|Which casino|WDT|NN
Which is the youngest county in New Jersey? |L|Which|Which is|WDT|VBZ
Which state has the strictest disclosure laws for legislators? |L|Which|Which state|WDT|NN
What is the world's busiest airport, measured by number of passengers?|X|What|What is|WP|VBZ
Which golf resort was rated best in the world by Conde Nast Traveler readers? |X|Which|Which golf|WDT|NN
Which state had the highest rate of bankruptcy filings last year? |L|Which|Which state|WDT|NN
What is the New Jersey state insect?|X|What|What is|WP|VBZ
What is the annual cost of membership to the Ivy Club, an eating club at Princeton University? |M|What|What is|WP|VBZ
Which town in America has the most expensive housing? |L|Which|Which town|WDT|NN
Which country has the highest per-capita Internet usage? |L|Which|Which country|WDT|NN
What was the top renting video of 1998? |W|What|What was|WP|VBD
What is the most popular major among Princeton University sophomores?|X|What|What is|WP|VBZ
What percentage of the world's nations have a free press?|C|What|What percentage|WP|NN
In 1996, 9,390 Americans were murdered with handguns. How many Canadians were killed with firearms in that same year?|A||||
