#Question|Class|WH|WH-Bigram|WH-POS|WH-NBOR-POS
During the past 10 years, 28 statewide referendum questions have appeared on the ballot. How many have been approved? |A||||
How much has crime risen, or fallen, in New Jersey's six largest cities over the past decade?|C|How|How much|WRB|JJ
Which airport had the highest percentage of delayed arriving flights in July?|O|Which|Which airport|WDT|NN
Which noted personality did NOT graduate from a high school in Mercer, Somerset or Middlesex County?|P|Which|Which noted|WDT|VBD
What is the fastest scheduled time for a NJ Transit train from Princeton Junction to Penn Station in New York?|R|What|What is|WP|VBZ
Which of the company best weathered last week's stock market slide?|O|Which|Which of|WDT|IN
Which state college in New Jersey had the largest percentage increase in tuition during the past 10 years?|O|Which|Which state|WDT|NN
Which member of Congress from New Jersey received the lowest marks on the Public Interest Research Group's (PIRG) 1998 Report Card? |P|Which|Which member|WDT|NN
The Princeton University football team has played its three non-conference opponents for the upcoming season - Lehigh, Lafayette and Fordham - a total of 86 times. How many of those games has Princeton lost? |A||||
Which shopping mall in New Jersey has the most stores? |O|Which|Which shopping|WDT|VBG
A state road sign on Nassau Street (Route 27), Princeton, lists three towns and the distances in miles to each of them. Two of the towns are Newark and New Brunswick. What is the third?|L||||
What percentage of employers disclose 401(k) investment or administrative fees to their participants?|C|What|What percentage|WP|NN
What was Witherspoon Street in Princeton called in the early years of the 19th century?|X|What|What was|WP|VBD
Which town in Mercer County had the highest average commuting time of residents in the last Census?|L|Which|Which town|WDT|NN
Which Ivy League school did not make this year's U.S. News & World Report's Top 10 list of best universities in the nation? |O|Which|Which Ivy|WDT|NNP
How much did tobacco heiress Doris Duke of Hillsborough bequeath her dog Minni?|M|How|How much|WRB|RB
Which is the final entry in the white page listings of the Princeton-Suburban Trenton phonebook?|X|Which|Which is|WDT|VBZ
Which town in Mercer County had the most reported bias crimes last year?|L|Which|Which town|WDT|NN
Which U.S. town has the highest elevation? |L|Which|Which U.S.|WDT|NNP
Which was the first of the Princeton University eating clubs to take up residence on Prospect Avenue?|O|Which|Which was|WDT|VBD
What is the state motto of New Jersey?|X|What|What is|WP|VBZ
What is the cost of a season ticket for the five Princeton University home football games this fall? |M|What|What is|WP|VBZ
Which Princeton restaurant had the most improved ratings in the 1999 Zagat Survey? |O|Which|Which Princeton|WDT|NNP
Which county in New Jersey releases the most toxic chemicals into the air, water and land? |L|Which|Which county|WDT|NN
What town in Mercer County has the largest percentage of residents more than 65 years of age?|L|What|What town|WP|NN
Which book did Nobel Prize-winner Thomas Mann complete during his 2 1/2 years in Princeton?|W|Which|Which book|WDT|NN
If the No. 600 NJ Transit bus is running on schedule, how long does it take to get from Forrestal Village in Plainsboro to the Trenton Rail Station if it leaves at 3:15 p.m.?|R||||
How often is the Princeton Alumni Weekly published? |R|How|How often|WRB|RB
Who was the first governor to occupy Morven in Princeton under state ownership?|P|Who|Who was|WP|VBD
Which town has the least amount of annual rainfall in New Jersey?|L|Which|Which town|WDT|NN
Which municipality in Mercer County had the fewest number of reported domestic violence incidents in 1996?|L|Which|Which municipality|WDT|NN
How did June Fletcher, Princeton University Class of 1973, gain national prominence?|X|How|How did|WRB|VBD
Which was the fastest-growing town in Mercer County between 1970 and 1994?|L|Which|Which was|WDT|VBD
"What percentage of women responding to a Harris Poll question about the fairness of divorce property settlements responded, ""I received too much."""|C|What|What percentage|WP|NN
"What is the English translation of Princeton University's motto: ""Dei Sub Numine Viget""?"|X|What|What is|WP|VBZ
Who persuaded Andrew Carnegie to finance the construction of a dam needed to create the 3.5-mile-long Carnegie Lake.|P|Who|Who persuaded|WP|VBD
Which region of the country has the highest gas prices?|L|Which|Which region|WDT|NN
What's the difference in annual principal and interest between a 7 percent, 30-year, $100,000 fixed rate mortgage and an 8 percent mortgage of the same term and amount?|M|What|What 's|WP|VBZ
During the 1990s, what percentage of all significant new drugs approved by the federal Food and Drug Administration have come from New Jersey?|C||||
Where did Albert Einstein live in Princeton prior to moving to 112 Mercer St.?|L|Where|Where did|WRB|VBD
Prior to the completion of Nassau Hall in Princeton in 1756, the trustees of the college had voted to name it after which person?|P||||
Which colleges and universities in New Jersey has the lowest percentage of females enrolled?|O|Which|Which colleges|WDT|NNS
What is the leading cause of death in the 25-44 year-old age group in New Jersey?|X|What|What is|WP|VBZ
What is the longest public golf course in New Jersey?|O|What|What is|WP|VBZ
"At a Democratic campaign training session for New Jersey officials last week, a political media consultant told the audience to focus on the three ""P's."" What are they? "|X||||
Which companies had the best stock market performance since Jan. 1?|O|Which|Which companies|WDT|NNS
How many Ivy League football championships has Princeton University won outright in the past 30 years?|A|How|How many|WRB|JJ
What percentage of businesses surveyed in New Jersey said they believed high schools were doing an above-average job of preparing students for the workplace?|C|What|What percentage|WP|NN
Where did Princeton University hold its commencements during most of the 19th Century?|L|Where|Where did|WRB|VBD
Which of Mercer County's 13 municipalities has the population with the oldest median age?|L|Which|Which of|WDT|IN
How many hotel rooms and suites are there in Somerset County? |A|How|How many|WRB|JJ
When executives are fired, what percentage of the time is it for incompetence?|C|When|When executives|WRB|NNS
What is the official state dinosaur of New Jersey? |X|What|What is|WP|VBZ
What percentage of reported auto thefts in New Jersey results in arrests?|C|What|What percentage|WP|NN
How many people have been killed by earthquakes in New Jersey during the past 300 years?|A|How|How many|WRB|JJ
Which New Jersey restaurant received the highest rating for decor in the 1998 Zagat Survey?|O|Which|Which New|WDT|NNP
In a national housing affordability study of 75 cities and regions, where did Central Jersey rank? (75th is least affordable.) |A||||
Which New Jersey towns had the lowest percentage of blacks in the last Census count?|L|Which|Which New|WDT|NNP
Which categories have the most listings in the Princeton-Suburban Trenton Area phone book?|X|Which|Which categories|WDT|NNS
How many vehicles are expected to travel on the Garden State Parkway over the three-day Fourth of July weekend?|A|How|How many|WRB|JJ
What percentage of Americans believe free trade agreements have a beneficial effect on salaries? |C|What|What percentage|WP|NN
When was the last time Rep. Michael Pappas' Web site was updated, according to the site's home page? |T|When|When was|WRB|VBD
On a scale of 0 to 4 - 4 being an A - what was the average GPA (grade point average) of humanities students at Princeton University between 1992 and 1997? |A||||
Muriel van Orden Jennings was the first alumna of the Princeton Theological Seminary. In what year did she graduate?|T||||
Which New Jersey county had the lowest rate of assaults on municipal police officers in 1996?|L|Which|Which New|WDT|NNP
How many volumes were there in the Princeton University library at the time of the Civil War?|A|How|How many|WRB|JJ
What is the record for most goals by a team in a World Cup soccer match?|A|What|What is|WP|VBZ
Which municipality in New Jersey had the highest percentage of Asian residents in the last Census?|L|Which|Which municipality|WDT|NN
How old is the oldest player on the Somerset Patriots baseball team?|Y|How|How old|WRB|JJ
Next to Rutgers, which college in New Jersey has the largest enrollment? |O||||
What former presidents of Princeton University were not graduates of Yale? |P|What|What former|WP|JJ
Which New Jersey native has had the most No. 1 records?|P|Which|Which New|WDT|NNP
Route 206 is known by four different names in Montgomery and Princeton. Which of the four does not appear on any of the street signs along Route 206?|X||||
Which Ivy League school had the highest minority enrollment among freshmen in 1995?|O|Which|Which Ivy|WDT|NNP
Which of the 1990, four-door sedans with 80,000 miles on it has the highest resale value in the Princeton area?|X|Which|Which of|WDT|IN
What was the most popular name for baby girls last year in New Jersey?|P|What|What was|WP|VBD
Eighteen members of the Princeton High School graduating class will be attending Rutgers in the fall. Which New Jersey college ranks second in the number of incoming freshmen from PHS? |O||||
What percentage of the people arrested for drunken driving in New Jersey in 1996 were women? |C|What|What percentage|WP|NN
How many of the Lawrenceville School's 204 graduating seniors will be attending Ivy League colleges next fall? |A|How|How many|WRB|JJ
What town has the lowest Zip Code number in New Jersey? |L|What|What town|WP|NN
When the Princeton Theological Seminary opened in 1812, how many students did it enroll?|A|When|When the|WRB|DT
Which town in New Jersey had the highest median family income in the last Census?|L|Which|Which town|WDT|NN
Princeton University lacrosse teams have won five national championships in the 1990s. How many Ivy League titles did they win during the 1970s and 1980s?|A||||
The first two scholars appointed as professors at the Institute for Advanced Study were Albert Einstein and whom?|P||||
How much did Carl Mayer spend per vote in Tuesday's Democratic primary in the 12th Congressional District? |M|How|How much|WRB|RB
Which presidential election between 1824 and 1996 had the most lopsided popular vote in New Jersey?|X|Which|Which presidential|WDT|JJ
Which restaurants in Princeton received the highest rating for service in the 1998 Zagat Survey of New Jersey restaurants?|O|Which|Which restaurants|WDT|NNS
How much did Princeton University pay for the 825-acre Forrestal tract and the 16 laboratory buildings that were housed on it?|M|How|How much|WRB|RB
Who was the youngest person ever elected to serve as president of Princeton University? |P|Who|Who was|WP|VBD
Who was the only Republican to carry the 15th District in a statewide, presidential or U.S. Senate race in the past five years? |P|Who|Who was|WP|VBD
What was the peak year for violent crime in New Jersey over the past 30 years? |T|What|What was|WP|VBD
What percentage of tolls collected on the New Jersey Turnpike is generated by out-of-state traffic? |C|What|What percentage|WP|NN
What was the percentage change in total compensation for CEOs of small firms - sales less than $15 million - in 1996? |C|What|What was|WP|VBD
Other than the U.S. and Canada, which country has the most students represented on the undergraduate student body at Princeton University. |L||||
Who is the largest private employer in Mercer County? |O|Who|Who is|WP|VBZ
There are 15 towns called Princeton in the United States. Which Princeton has the largest population?|L||||
How many American soldiers died on the battlefield during World Wars I and II, the Korean Conflict and the Vietnam War?|A|How|How many|WRB|JJ
During an average year, how many days are there with some precipitation - rain or snow - in New Jersey? |R||||
In the early part of the 20th Century, who was the occupant of the Lower Pyne Building, now occupied by Hamilton Jewelers, at the corner of Nassau and Witherspoon streets in Princeton Borough?|P||||
What is the fine for exceeding the new 65 mph speed limit, which takes effect on 475 miles of controlled-access highways in New Jersey Tuesday, by 1 to 9 mph? |M|What|What is|WP|VBZ
What is the cost per week of sending a son or daughter to Princeton University? |M|What|What is|WP|VBZ
What percentage of companies in New Jersey pick up between 91 and 100 percent of the health care tab for employees' family coverage? |C|What|What percentage|WP|NN
What percentage of American women polled reported having had extramarital sex within the past year? |C|What|What percentage|WP|NN
"What percentage of Princeton High School students polled said they thought the decision to lengthen the school day by 24 minutes this year was an ""excellent"" one? "|C|What|What percentage|WP|NN
Which county in New Jersey has the largest farms, measured in average acres per farm? |L|Which|Which county|WDT|NN
Princeton University is the largest taxpayer in Princeton Township. Who is second?|O||||
In percentage terms, which newspaper in New Jersey lost the most daily circulation between 1990 and 1997? |O||||
What town had the most expensive housing in New Jersey in 1996? |L|What|What town|WP|NN
Which eating club at Princeton University has the highest percentage of members that have tried marijuana? |O|Which|Which eating|WDT|VBG
Smith is the most frequently listed name in the Princeton-Suburban Trenton Area phonebook. What is the second most common name? |P||||
Which restaurant was rated the favorite in New Jersey in the 1998 Zagat Survey?|O|Which|Which restaurant|WDT|NN
Which town in central Jersey has the largest population?|L|Which|Which town|WDT|NN
New Jersey continues to have the highest auto insurance rates in the nation, with an average premium of $1,259 in 1996. Which state has the lowest rates?|L||||
If the stock market fell as far tomorrow as it did between 1929 and 1932, what would the Dow Jones Index be, based on Friday's close of 9,147? |A||||
During what decade in the 20th Century was the rate of growth in the New Jersey state budget the greatest? |T||||
Of the 1,087 members of the newly graduated Princeton University Class of 1996 responding to a survey, 71 said they planned to pursue studies in medicine. How many said they planned to attend graduate school for business?|A||||
New Jersey's cancer rates are higher than the national averages for virtually every major type of cancer. Among white males in New Jersey, there is one exception. What is it?|X||||
Since 1840, Essex County has been the most populous county in New Jersey in every Census count but 1900, 1910 and 1990. Which county had the largest population in 1800 and 1820?|L||||
Which school district in Mercer, Middlesex, Somerset and Hunterdon counties had the lowest voter turnout in last week's school electons?|L|Which|Which school|WDT|NN
"Which state was the speaker referring to in the following quote? ""We have a world-class transportation system in our state."" "|L|Which|Which state|WDT|NN
Which town had the third lowest overall crime rate but the second highest violent crime rate among suburban municipalities in Mercer, Middlesex and Somerset counties in 1996?|L|Which|Which town|WDT|NN
What corporate CEO received the most compensation between 1995 and 1997?|P|What|What corporate|WP|JJ
"What percentage of Princeton University students polled by the student newspaper reported having had sexual intercourse ""in their lifetime?"""|C|What|What percentage|WP|NN
Which town in central Jersey is the largest geographically?|L|Which|Which town|WDT|NN
Why has the dollar weakened against the yen?|X|Why|Why has|WRB|VBZ
How is I.Q. tested?|X|How|How is|WRB|VBZ
Where is the St. Herman of Alaska Brotherhood located?|L|Where|Where is|WRB|VBZ
Where was the 1968 summer olympics held?|L|Where|Where was|WRB|VBD
What Apollo mission was the first to circle the moon?|X|What|What Apollo|WP|NNP
What are the symptoms of Chronic Fatigue Syndrome?|X|What|What are|WP|VBP
Who wrote the once and future king?|P|Who|Who wrote|WP|VBD
Who is the first president of Turkey?|P|Who|Who is|WP|VBZ
What was the Second Great Awakening in religious history?|F|What|What was|WP|VBD
Who was the seventeenth president of the United States?|P|Who|Who was|WP|VBD
What virus spread in U.S. in 1968?|X|What|What virus|WP|NN
What is the life span of a white tailed deer?|R|What|What is|WP|VBZ
What is ritialin made from?|X|What|What is|WP|VBZ
At what intensity does the human eye stop seeing light?|A||||
What kind of tanks does Israel have?|X|What|What kind|WP|NN
What are side effects of Claritin?|X|What|What are|WP|VBP
What is the relationship of tv/computers and teen weightloss?|X|What|What is|WP|VBZ
What percentage of residential phones have call screening devices?|C|What|What percentage|WP|NN
How many farmers are there in the U.S. today?|A|How|How many|WRB|JJ
What is magnet therapy?|F|What|What is|WP|VBZ
What are some model railroad magazines?|W|What|What are|WP|VBP
Who is Douglas Stuart?|P|Who|Who is|WP|VBZ
How much does Canada spend on NATO?|M|How|How much|WRB|JJ
Who is Matthew Hopkins?|P|Who|Who is|WP|VBZ
What is a felt maker called?|F|What|What is|WP|VBZ
Who is Harrison Ford?|F|Who|Who is|WP|VBZ
What is the ESA?|B|What|What is|WP|VBZ
Who is the world's number one golfer?|P|Who|Who is|WP|VBZ
What are some traditional anniversary gifts?|X|What|What are|WP|VBP
"Who wrote the poem called ""Trees""?"|P|Who|Who wrote|WP|VBD
What is the cost of an ultralight plane in New Zealand?|M|What|What is|WP|VBZ
What route did Lewis and Clark take going west in 1804?|X|What|What route|WP|NN
What does FTP stand for?|B|What|What does|WP|VBZ
What is the best way to propagate rosemary?|X|What|What is|WP|VBZ
What is the average salary of a MCSE in Australia?|M|What|What is|WP|VBZ
What happened on January 29th, 1954?|X|What|What happened|WP|VBD
What is the average Body Mass Index (BMI) for teenage girls?|A|What|What is|WP|VBZ
Who was the eighth president of the United States?|P|Who|Who was|WP|VBD
What does a buffalo look like?|X|What|What does|WP|VBZ
What is Ralph Steadman best known for?|F|What|What is|WP|VBZ
What is the average temperature in Tokyo?|A|What|What is|WP|VBZ
What percentage of the United States is mormon?|C|What|What percentage|WP|NN
How many people survived the Titanic?|A|How|How many|WRB|JJ
What are some ingredients for beef brisket?|X|What|What are|WP|VBP
Who is Dionysius?|F|Who|Who is|WP|VBZ
Who wrote Oliver, the musical?|P|Who|Who wrote|WP|VBD
How many Catholic churches are there in South Dakota?|A|How|How many|WRB|JJ
What sport do the Buffalo Bills play?|X|What|What sport|WP|NN
What is MS DOS?|B|What|What is|WP|VBZ
Where can I go to renew my United Kingdom passport?|L|Where|Where can|WRB|MD
How many Appollo missions have there been?|A|How|How many|WRB|JJ
What is a sound sampler?|X|What|What is|WP|VBZ
What plays did William Mastrosimone write? |W|What|What plays|WP|VBZ
Who is the king of Belgium?|P|Who|Who is|WP|VBZ
What percentage of Amsterdam uses drugs?|C|What|What percentage|WP|NN
Who is Charles Chaplin?|F|Who|Who is|WP|VBZ
What are the symptoms of Candida Albicans? |X|What|What are|WP|VBP
What tools are used for electrolysis?|X|What|What tools|WP|EX
What is sleep apnea?|F|What|What is|WP|VBZ
Where is Cuchulainn?|L|Where|Where is|WRB|VBZ
How old is the Pope?|Y|How|How old|WRB|JJ
What is Huntington's chorea?|F|What|What is|WP|VBZ
When was the Yom Kipur War in Israel?|T|When|When was|WRB|VBD
When was the first silver dollar made?|T|When|When was|WRB|VBD
What is Tourette's syndrome?|F|What|What is|WP|VBZ
What is the population of Iowa?|A|What|What is|WP|VBZ
Who is James Taylor?|F|Who|Who is|WP|VBZ
How many calories are in a strawberry?|A|How|How many|WRB|JJ
What is the smallest fish?|X|What|What is|WP|VBZ
What are pins on computer hard drives?|X|What|What are|WP|VBP
Who is Robert McCloskey?|F|Who|Who is|WP|VBZ
Who is Pierre Curie?|F|Who|Who is|WP|VBZ
What was the population of the United States in 1968?|A|What|What was|WP|VBD
Who discovered pyroelectricity?|P|Who|Who discovered|WP|VBD
Who was the father of rocketry? |P|Who|Who was|WP|VBD
Where is Naples, Italy?|L|Where|Where is|WRB|VBZ
What country causes the most pollution? |L|What|What country|WP|NN
What are the symptoms of poisoning in a child? |X|What|What are|WP|VBP
What were the treatments for arsenic poisoning in the 1840's?|X|What|What were|WP|VBD
What are some native amercian customs and rituals? |X|What|What are|WP|VBP
Where were the Kiowa Indians located? |L|Where|Where were|WRB|VBD
How many cities are there in Poland?|A|How|How many|WRB|JJ
"Who wrote the book, ""Brave New World""?"|P|Who|Who wrote|WP|VBD
When was J. Crew founded?|T|When|When was|WRB|VBD
What is U2's latest album?|F|What|What is|WP|VBZ
What do Eastern Orthodox women wear? |X|What|What do|WP|VBP
Who is the president of El Salvador? |P|Who|Who is|WP|VBZ
Where is the Saguaro National Monument? |L|Where|Where is|WRB|VBZ
What is the population of Sydney?|A|What|What is|WP|VBZ
When did Ben Franklin invent bifocals?|T|When|When did|WRB|VBD
What is a steel mill?|F|What|What is|WP|VBZ
What is the cost of living in New Orleans? |M|What|What is|WP|VBZ
Who is the actress that plays Dilann on Babylon 5?|P|Who|Who is|WP|VBZ
How many arabian horses are there in the United States? |A|How|How many|WRB|JJ
What horse has won the most prize money in racing?|X|What|What horse|WP|NN
What is the world's largest building?|X|What|What is|WP|VBZ
What diseases are tingling sensations in the limbs a symptom of?|X|What|What diseases|WP|VBZ
Where is James Cook University? |L|Where|Where is|WRB|VBZ
What is the name of the japenese stock market? |X|What|What is|WP|VBZ
What are supernovas?|F|What|What are|WP|VBP
What should I feed an llama?|X|What|What should|WP|MD
Where were the 1998 Olympics?|L|Where|Where were|WRB|VBD
What is the capital of Canada?|L|What|What is|WP|VBZ
What are the effects of corrosion on the Eiffel Tower? |X|What|What are|WP|VBP
Who is a famous ballad writing poet? |P|Who|Who is|WP|VBZ
What is the capital of Ghana?|L|What|What is|WP|VBZ
How much does a Pentium II 233 MHz processor cost?|M|How|How much|WRB|JJ
How many rich people live in the US?|A|How|How many|WRB|JJ
What pills can you take to stop smoking?|X|What|What pills|WP|VBZ
Who invented science fiction?|P|Who|Who invented|WP|VBD
Who is Mary Poppins?|F|Who|Who is|WP|VBZ
"Who is the author of ""Stranger in a Strange Land""?"|P|Who|Who is|WP|VBZ
Who is Maya Angelou?|F|Who|Who is|WP|VBZ
What is the average salary of a librarian?|M|What|What is|WP|VBZ
How many calories are in one cup of skim milk?|A|How|How many|WRB|JJ
What is a grenade?|F|What|What is|WP|VBZ
Where is Bergen Beach?|L|Where|Where is|WRB|VBZ
How fast do bullets travel?|A|How|How fast|WRB|RB
Where is New York's 63rd precinct? |L|Where|Where is|WRB|VBZ
What are car prices in Holland?|M|What|What are|WP|VBP
How many people are there in the Senate?|A|How|How many|WRB|JJ
What year was golf invented?|T|What|What year|WP|NN
What are black holes?|F|What|What are|WP|VBP
What is the Bermuda Triangle?|F|What|What is|WP|VBZ
What is Stonehenge?|F|What|What is|WP|VBZ
How many square meters are in one acre?|A|How|How many|WRB|JJ
Who is Bigfoot?|F|Who|Who is|WP|VBZ
At what age can I draw money out of a roth IRA?|Y||||
What is an optical illusion?|F|What|What is|WP|VBZ
What is the tallest mountain in the world?|X|What|What is|WP|VBZ
What did women wear during the American Revolution?|X|What|What did|WP|VBD
How does mold grow?|X|How|How does|WRB|VBZ
What does 20/20 vision mean?|X|What|What does|WP|VBZ
What is the climate like in Michigan?|X|What|What is|WP|VBZ
What kind of treatments are there for severe neck pain?|X|What|What kind|WP|NN
What percentage of children living in poverty in Minnesota are Hispanic? |C|What|What percentage|WP|NN
How many natural disasters were there in the United States in 1997?|A|How|How many|WRB|JJ
What are the hunting seasons in Pennsylvania?|X|What|What are|WP|VBP
Who is the bishop of the diocese of Northern California? |P|Who|Who is|WP|VBZ
What did Franklin D. Roosevelt do for the people in 1940?|X|What|What did|WP|VBD
What are tendons?|F|What|What are|WP|VBP
Who ran for president of the United States in 1940?|P|Who|Who ran|WP|VBD
What is criminology? |F|What|What is|WP|VBZ
What is the unemployment rate in France?|C|What|What is|WP|VBZ
Who ran for governor of Minnesota in the 1998 general election?|P|Who|Who ran|WP|VBD
What is the unemployment insurance rate for the State of Georgia? |C|What|What is|WP|VBZ
What does presidential censure entail? |X|What|What does|WP|VBZ
How do you determine if a year is a leap year? |X|How|How do|WRB|VB
How do I define a music ontology? |F|How|How do|WRB|VBP
How much do commercial jets sell for?|M|How|How much|WRB|JJ
What city is the phone number 651-578-3070 located in?|L|What|What city|WP|NN
What is interesting to visit in Frankfurt?|X|What|What is|WP|VBZ
What was the Academy Award best picture in 1971?|W|What|What was|WP|VBD
Who was the Grammy winner for best album in 1970?|P|Who|Who was|WP|VBD
What does ASTM stand for?|B|What|What does|WP|VBZ
What was the price of gold in 1950?|M|What|What was|WP|VBD
What are some side effects from getting a flu shot?|X|What|What are|WP|VBP
What is the latitude of Rochester, New York?|A|What|What is|WP|VBZ
Which president is on the five dollar bill?|P|Which|Which president|WDT|NN
What was the top K-12 school in the US in 1997?|X|What|What was|WP|VBD
